Date,Text_clean
2020-04-25,ACA Credit Agricole SA Crdit Agricole SA Assemble Gnrale des actionnaires du 13 mai 2020 Lassemble gnrale se tiendra  huis clos en raison de la crise du Covid19 Dans ce contexte et conformment  la recommandation de la BCE la socit  
2020-04-25,ACA Credit Agricole SA Crdit Agricole SA   equity stocks 
2020-04-24,ACAs price moved below its 50day Moving Average on April 21 2020 View odds for this and other indicators  Arcosa stockmarket stock technicalanalysis money trading investing daytrading news today 
2020-04-24,CREDIT AGRICOLE ACA otro ejemplo peligroso en la banca europea de cara a las prximas semanas 
2020-04-24,ACAs price moved below its 50day Moving Average on April 21 2020 View odds for this and other indicators  Arcosa stockmarket stock technicalanalysis money trading investing daytrading news today 
2020-04-23,Scan results  MACD Bearish Signal Line Cross today NTGR ECHO WRE BIIB SSB GGG ACA HRL FTNT ZS RNR CAJ RCI PTON FCFS GEO HPP PDM AJG CBU  
2020-04-23, Martinez So in other words dont kill the workers who do the work and buy the stuff  rich peoples  companies make keeppeoplehealthy save ACA
2020-04-23,bourse Configuration assez similaire pour ACA 
2020-04-23,by the way this unscalable supply problem is not unique to  MKR on  ETHLabs KAVA on  ATOM ACA on  DOTwill all have the same issuesthe only way to win is to collateralize centrally issued assets 
2020-04-22,ACA Stocks StockMarket Arcosa published Q4 EPS on  Earnings deteriorated from preceding quarter by 3507  from 067 per share Sales increased by 0427  from 445 millions 
2020-04-22,200 DMA Support today ACA STM  
2020-04-22,PRO 220 AXPR 220 XAS 215 SEFA 207 DML 205 DSLA 203 ACA 198 NEX 197 SRN 192 HIVE 191cryptocurrency 
2020-04-22,ETZ 228 PNX 226 XCM 223 AXPR 219 PRO 218 SEFA 207 DML 204 ACA 198 DSLA 195 FREE 192cryptocurrency 
2020-04-21,Scan results  Fell Below 50 DMA today BNTX DOX CRM SAP FTNT TTGT ENTG TSM AYX KLIC VMW ACA AAXN SILK AUDC A ZEN POWI MTSI CHKP  
2020-04-21,ACAs Aroon indicator drops into Downtrend on April 17 2020 View odds for this and other indicators  Arcosa stockmarket stock technicalanalysis money trading investing daytrading news today 
2020-04-21,50 DMA Resistance today NUS WKHS ACA BL HCKT SANM NATI COKE CVLT SSPK HTLD ASND XENE ENTG KIDS LANC ADUS SMTC ARQT WHG  
2020-04-21,Arcosa Announces Change to 2020 Annual Shareholder Meeting Format ACA coronavirus COVID2019 
2020-04-21,Arcosa Inc ACA Short Interest Down 175 in March  stocks
2020-04-21,Arcosa Inc ACA Short Interest Down 175 in March 
2020-04-20,ACAs Aroon indicator drops into Downtrend on April 17 2020 View odds for this and other indicators  Arcosa stockmarket stock technicalanalysis money trading investing daytrading news today 
2020-04-20,50 DMA Support today ACA EDNT AAP GPL  
2020-04-20,Les 5 valeurs europennes les plus intressantes de la semaine CAC40 DAX30 NASDAQ DowJones SPY spy aca aca 
2020-04-20,Short Interest in Arcosa Inc ACA Declines By 175 
2020-04-20,ACAs Aroon indicator drops into Downtrend on April 17 2020 View odds for this and other indicators  Arcosa stockmarket stock technicalanalysis money trading investing daytrading news today 
2020-04-19,Short Interest in Arcosa Inc ACA Drops By 175 
2020-04-19,Short Interest in Arcosa Inc ACA Drops By 175 
2020-04-18,ACAs Aroon indicator drops into Downtrend on April 17 2020 View odds for this and other indicators  Arcosa stockmarket stock technicalanalysis money trading investing daytrading news today 
2020-04-18,On May 13 2020 Philippe De Waal will start a role as Director  SD at  BoardExAlerts CAC40 EURONEXT100 SBF120 ACA
2020-04-18,On May 13 2020 MarieClaire Daveu will start a role as Director  SD at  BoardExAlerts CAC40 EURONEXT100 SBF120 ACA
2020-04-18,On May 13 2020 Veronique Flachaire will leave a role as Director  SD at  BoardExAlerts CAC40 EURONEXT100 SBF120 ACA
2020-04-17,ACA Arcosa Inc Announces Change to 2020 Annual Shareholder Meeting Format 
2020-04-17,Arcosa Announces Change to 2020 Annual Shareholder Meeting Format ACA coronavirus COVID2019 
2020-04-17,ACAs in Uptrend Moving Average Convergence Divergence MACD Histogram just turned positive View odds for this and other indicators  Arcosa stockmarket stock technicalanalysis money trading investing daytrading news today 
2020-04-17,50 DMA Resistance today ACA  
2020-04-17,A surveiller Air Canada sera cloue au sol plus longtemps que prvu ACa la banque du Midwest TCF Financial est intressante TCF un bon carnet et lventuelle reprise positionnent bien le constructeur Aecon ARE Lesaffairescom 
2020-04-17,On May 13 2020 Philippe Boujut will leave a role as Director  SD at CREDIT AGRICOLE SA BoardExAlerts CAC40 CACALLTRADABLE EURONEXT100 SBF120 ACA
2020-04-17,France Stocks Franais Bourse Hospitality AC 59 Defense SAF 99 HO 53 Luxury MC 49 KER 63 Aerospace AIR 74 Biotech GKTX 54 Energy FP 46 Financial svc RF 57 ACA 58 Construction DG 87 Medical lab ERF 41 IPS 86
2020-04-16,ACA daily  sur le fil 
2020-04-16,ACAs Aroon indicator reaches into Uptrend on March 30 2020 View odds for this and other indicators  Arcosa stockmarket stock technicalanalysis money trading investing daytrading news today 
2020-04-16,ACA CREDITAGRICOLE  1H Agricole CREDIT AGRICOLE sinscrit dans une tendance baissire Les traders pourraient envisager de ne traiter que les positions shorts  la vente tant que le cours reste bien situ sous 6725 EUR Le support suivant 
2020-04-16,200 DMA Support today TERP NSTG ACA TECH DIOD  
2020-04-16,ACA CREDITAGRICOLE  1H CREDIT AGRICOLE sinscrit dans une tendance baissire Les traders pourraient envisager de ne traiter que les positions shorts  la vente tant que 
2020-04-15,ACA in Uptrend price may ascend as a result of having broken its lower Bollinger Band on March 12 2020 View odds for this and other indicators  Arcosa stockmarket stock technicalanalysis money trading investing daytrading news today 
2020-04-15,Fell Below 50 DMA today ACA VONG  
2020-04-14,ACA in Uptrend price may jump up because it broke its lower Bollinger Band on March 12 2020 View odds for this and other indicators  Arcosa stockmarket stock technicalanalysis money trading investing daytrading news today 
2020-04-14,ACA NEW ARTICLE  Arcosa  A Year Of Successful Turnaround  Get all the latest ACA related news here  
2020-04-14,ACA  Arcosa  A Year Of Successful Turnaround  business economy stocks
2020-04-14,50 DMA Support today ACA  
2020-04-14,Dividend TodayP1ABBV ABT ACA AFG ALG ATVI AVK BAF BBF BBK BBN BCX BDJ BDXA BELFA BELFB BFK BFO BFY BFZ BGIO BGR BGT BGY BHK BHV BIT BKK BKN BKT BLE BLW BME BNY BOE BQH BSD BSE BST Free stocks app 
2020-04-14,Todays exdividends dividendsABBV ABT ACA ADNV AFG ALG ATHM ATVI BELFA BELFB CAC CEN CHCO CMTL EGBN and more
2020-04-14,Arcosa Announces Timing of First Quarter 2020 Earnings Release and Conference Call ACA 
2020-04-13,ACA Arcosa Inc Announces Timing of First Quarter 2020 Earnings Release and Conference Call 
2020-04-13,ACA Issued Press Release on April 13 161500 Arcosa Inc Announces Timing of First Quarter 2020 Earnings Release and Conference Call 
2020-04-13,ACA in Uptrend price expected to rise as it breaks its lower Bollinger Band on March 12 2020 View odds for this and other indicators  Arcosa stockmarket stock technicalanalysis money trading investing daytrading news today 
2020-04-13,Fell Below 50 DMA today ATSG AMAG WEC ACA MKC  
2020-04-13,Arcosa Inc Plans Quarterly Dividend of 005 ACA  stocks
2020-04-13,Arcosa Inc Plans Quarterly Dividend of 005 ACA 
2020-04-13,Arcosa ACA Cut to Hold at Zacks Investment Research 
2020-04-13,Arcosa ACA Cut to Hold at Zacks Investment Research 
2020-04-13,Arcosa ACA Cut to Hold at Zacks Investment Research 
2020-04-12,ACA in Uptrend price may ascend as a result of having broken its lower Bollinger Band on March 12 2020 View odds for this and other indicators  Arcosa stockmarket stock technicalanalysis money trading investing daytrading news today 
2020-04-12,Arcosa ACA Stock Rating Lowered by Zacks Investment Research  stocks
2020-04-12,Arcosa ACA Stock Rating Lowered by Zacks Investment Research 
2020-04-12,Arcosa Inc ACA Declares Quarterly Dividend of 005 
2020-04-12,Zacks Investment Research Upgrades Arcosa ACA to Buy 
2020-04-12,Zacks Investment Research Upgrades Arcosa ACA to Buy 
2020-04-12,The PiotroskiF score of ACA is 800 indicating great health for ACA  
2020-04-11,ACA in Uptrend price may jump up because it broke its lower Bollinger Band on March 12 2020 View odds for this and other indicators  Arcosa stockmarket stock technicalanalysis money trading investing daytrading news today 
2020-04-10,NTY 867282252907 ACA 866931180261 999 745135373754 GARD 731790610077 ESCE 640578741069 CREDIT 634845198262 TIPS 619312061926 LDOGE 614663639937 EXRN 535154388195 XPAT 533678299503cryptocurrency 
2020-04-10,ACA in Uptrend price expected to rise as it breaks its lower Bollinger Band on March 12 2020 View odds for this and other indicators  Arcosa stockmarket stock technicalanalysis money trading investing daytrading news today 
2020-04-10,Arcosa Stock Rating Upgraded by Zacks Investment Research ACA 
2020-04-10,Arcosa ACA Stock Rating Upgraded by Zacks Investment Research  stocks
2020-04-10,Arcosa ACA Stock Rating Upgraded by Zacks Investment Research 
2020-04-10,FY2020 Earnings Estimate for Arcosa Inc ACA Issued By GResearch 
2020-04-09,Scan results  MACD Bullish Centerline Cross today BDXA CYRX GBT PLD FNV BERY HUM MXL SPGI RESI CYTK NTRS PGR BAX TER RGLD ACA SMAR CBU DRE  
2020-04-09,ACA in Uptrend price expected to rise as it breaks its lower Bollinger Band on March 12 2020 View odds for this and other indicators  Arcosa stockmarket stock technicalanalysis money trading investing daytrading news today 
2020-04-09,Arcosa Inc ACA to Post FY2020 Earnings of 195 Per Share GResearch Forecasts  stocks
2020-04-09,Arcosa Inc ACA to Post FY2020 Earnings of 195 Per Share GResearch Forecasts 
2020-04-09,50 DMA Support today ONVO FTS ACA  
2020-04-09,CrditAgricole  Le titre tente de matrialiser une figure de retournement un double bottom Cette figure sera valide uniquement sur la cassure des 765ACA 
2020-04-09,HTML 99 DOLLAR 99 DAPS 99 OF 99 PNT 99 HBAR 99 ZEON 99 HSC 99 ACA 99 NPXSXEM 99cryptocurrency 
2020-04-09, I was not real enthused about the drop off in shipments I have a position in TRN  ACA in effect a presplit position but GBX being the leader in the railcar leasing space does need to be looked at
2020-04-08,Equities Research Analysts Upgrades for April 8th ACA ADPT AFYA ALRS AROW ASAZY ASR AVNW AVXL AXGT  markets
2020-04-08,Equities Research Analysts Upgrades for April 8th ACA ADPT AFYA ALRS AROW ASAZY ASR AVNW AVXL AXGT  stocks
2020-04-08,Scan results  Stochastic Sell Signal today LVGO CBZ QLYS EXR ACA COO INGN NFLX PM BWXT NSA YY INTC EQM MKTX LMT MKC RGEN SINA TW  
2020-04-08,HTML 99 DOLLAR 99 DAPS 99 OF 99 PNT 99 HBAR 99 ZEON 99 HSC 99 ACA 99 NPXSXEM 99cryptocurrency 
2020-04-08,ACA in Uptrend price may ascend as a result of having broken its lower Bollinger Band on March 12 2020 View odds for this and other indicators  Arcosa stockmarket stock technicalanalysis money trading investing daytrading news today 
2020-04-08,ACA technical alerts 50 DMA Resistance Fell Below 200 DMA Bearish Engulfing NonADX 1234 B 
2020-04-08,Arcosa ACA Trading Down 61 
2020-04-08,Bourse cac40 equities Potentielle Cup amp Handle sur le CAC40 Possible que ce soit encore un peu compliqu sous 4540 dans les prochaines heures mais la zone des 51155160 dici fin avril ne semble pas utopiqueToujours en position acheteuse sur ACA creditagricole 
2020-04-07,Scan results  Bearish Engulfing today PETS TSG VRTX ATVI FATE NCR NEOG RLI NUE HLF OUT ACA GRMN CBOE ARCH HAE RMD BMY SJM XNCR  
2020-04-07,Scan results  Bearish Engulfing today PETS ATVI FATE NEOG HLF NUE NCR OUT ACA VRTX RLI GRMN CBOE HAE RMD UL RTRX EBS SJM TSG  
2020-04-07,ACA in Uptrend price expected to rise as it breaks its lower Bollinger Band on March 12 2020 View odds for this and other indicators  Arcosa stockmarket stock technicalanalysis money trading investing daytrading news today 
2020-04-07,50 DMA Resistance today AKCA ACA  
2020-04-07,France Stocks Franais Bourse Luxury MC 28 Insurance CS 53 ConsultingBPO CAP 76 Financial svc ACA 93 Electric Utility ENGI 2 Auto RNO 46 Food SW 55 Geophysical svc CGG 96 Biotech LYS 11 ABVX 35 Semiconductor STM 62
2020-04-07,Arcosa ACA Trading Up 74 
2020-04-06,Extrae efectivo de tu Dbito Chaco 24  mediante AC PESOS  en Comercios Adheridos Y ademas si realizas una compra mnima podes extraer efectivo de tu Mastercard Dbito Chaco 24   de los comercios mencionados  NBCH TuBancoTeBanca SacaPesos QuedateEnCasa
2020-04-06,ACA in Uptrend price may jump up because it broke its lower Bollinger Band on March 12 2020 View odds for this and other indicators  Arcosa stockmarket stock technicalanalysis money trading investing daytrading news today 
2020-04-06,200 DMA Support today ACA  
2020-04-06,ACA CREDITAGRICOLE  1H Agricole La tendance baissire de fond sur cette unit de temps sestelle essouffle ou manque telle de puissance Le court terme noffre encore aucune information qui permettrait danticiper une reprise du mouvement 
2020-04-06,ACA CREDITAGRICOLE  1H La tendance baissire de fond sur cette unit de temps sestelle essouffle ou manque telle de puissance Le court terme noffre encore aucune 
2020-04-06, Watchlist CT du 6 avril 2019  JXR XFAB EUCAR ACA CGG  AIR
2020-04-06,aca creditagricole bourse equity trading banque CAC40 joli riskreward sur Crdit Agricole qui se stabilise au dessus des 560 euros 786 Fibo de 20122017 M20d tente de saplatir Spread M20M5589 bcp trop large Potentiel double creux Je vise 975 avec stop  550 
2020-04-05,ACA in Uptrend price expected to rise as it breaks its lower Bollinger Band on March 12 2020 View odds for this and other indicators  Arcosa stockmarket stock technicalanalysis money trading investing daytrading news today 
2020-04-05,Juste une ide sur crdit agricole acaOn peut avoir une poursuite de la baisse en dbut de mois vers le support des 470 tenter un achat ici et un gros rebond en 2me partie qui chercherait un contact avec la boll inf 
2020-04-05,bourse  Peut tre parce que si cest la fin des bancaires cest la fin du monde  plus srieusement les titres ne cotent pas terrible mais ce sont des socits rentables avec des milliards en RN donc du ACA par exemple a 5e reste un bon choix dinvestissement long terme par ex
2020-04-04,Arcosa ACA Rating Increased to Hold at ValuEngine  markets
2020-04-04,ACA in Uptrend price may jump up because it broke its lower Bollinger Band on March 12 2020 View odds for this and other indicators  Arcosa stockmarket stock technicalanalysis money trading investing daytrading news today 
2020-04-04,ACA Credit Agricole SA Crdit Agricole SA   equity stocks 
2020-04-04,Couple of underfollowed infrastructure stocks to cover in the next couple of weeksGLW MTZ NWPX GTLS POWL ROAD ACAand theres probably more to add here
2020-04-03,ACA in Uptrend price may jump up because it broke its lower Bollinger Band on March 12 2020 View odds for this and other indicators  Arcosa stockmarket stock technicalanalysis money trading investing daytrading news today 
2020-04-02,Scan results  Stochastic Sell Signal today INSW DOCU GLIBA FTNT BRKS CHDN RELX BOX NUS SBAC IR FICO ALL QTS CONE NGG ACA KBR FDS WST  
2020-04-02,ACAs Aroon indicator reaches into Uptrend on March 30 2020 View odds for this and other indicators  Arcosa stockmarket stock technicalanalysis money trading investing daytrading news today 
2020-04-02,Signals on Market Cap gt 1bn  for 27032020  KBH  ACA  GPS  CRL  ETFC  DDOG  NTRS  STT  AMTD  SPOT
2020-04-02,ACANew Insider Filing on Arcosa IncsDirectorRONALD J GAFFORD
2020-04-02,ACANew Insider Filing on Arcosa IncsDirectorJOHN W LINDSAY
2020-04-01,ACANew Insider Filing on Arcosa IncsDirectorDOUGLAS L ROCK
2020-04-01,ACANew Insider Filing on Arcosa IncsDirectorDAVID W BIEGLER
2020-04-01,ACANew Insider Filing on Arcosa IncsPresident amp CEOANTONIO CARRILLO
2020-04-01,ACA filed SEC form 4 Director BIEGLER DAVID W Transacted Derivative Securities on 20200331  
2020-04-01,ACA filed SEC form 4 Director ROCK DOUGLAS L Transacted Derivative Securities on 20200331  
2020-04-01,ACA enters an Uptrend because Momentum Indicator exceeded the 0 level on March 30 2020 View odds for this and other indicators  Arcosa stockmarket stock technicalanalysis money trading investing daytrading news today 
2020-04-01,ACA Incapable de franchir le 1er palier de retracementle non croisement baissier m7m20 risque de faire mal cest moche 
2020-04-01,Crdit Agricole SA  proposition daffectation  un compte de rserves des rsultats de lanne 2019bourse finance ACA
2020-04-01,Signals on Market Cap gt 1bn  for 27032020  KBH  ACA  GPS  CRL  ETFC  DDOG  NTRS  STT  AMTD  SPOT
2020-04-01,France Stocks Franais Bourse Financial svc ACA 52 Food BN 24 Aerospace AIR 9 FinTech WLN 43 Pharma IPH 28 Electrical supplies RXL 75 Contsruction DG 75 Defense SAF 12 Luxury MC 39 RMS 35 Advertise DEC 22 Bank KN 77
2020-04-01,ACA CREDITAGRICOLE  1H Agricole On peut voir  court terme une acclration de la tendance baissire de fond sur cette unit de temps pour CREDIT AGRICOLE Cest un signal positif pour les vendeurs Tant que le cours se maintient sous 6529 
2020-04-01,ACA CREDITAGRICOLE  1H On peut voir  court terme une acclration de la tendance baissire de fond sur cette unit de temps pour CREDIT AGRICOLE Cest un signal 
2020-03-31,ACA enters an Uptrend because Momentum Indicator exceeded the 0 level on March 30 2020 View odds for this and other indicators  Arcosa stockmarket stock technicalanalysis money trading investing daytrading news today 
2020-03-31,200 DMA Support today ACA PEN  
2020-03-31,ACA CREDIT AGRICOLE  Goldman Sachs passe  lAchat 
2020-03-31,Arcosa ACA Trading 63 Higher 
2020-03-30,cat Gracies ACA per augmentar biodiversitat de la vegetaci de ribera per fomentar els hotels dinsectes amb la fusta restant i per fer ho a la millor epoca de lany per nidificaci i deixarho preparat per lerosi total de la llera si ho arriba a fer un privat lenpaperenfort
2020-03-30,ACAs Aroon indicator reaches into Uptrend on March 27 2020 View odds for this and other indicators  Arcosa stockmarket stock technicalanalysis money trading investing daytrading news today 
2020-03-29,ACAs Aroon indicator reaches into Uptrend on March 27 2020 View odds for this and other indicators  Arcosa stockmarket stock technicalanalysis money trading investing daytrading news today 
2020-03-28,ACAs Aroon indicator reaches into Uptrend on March 27 2020 View odds for this and other indicators  Arcosa stockmarket stock technicalanalysis money trading investing daytrading news today 
2020-03-28,ACA Credit Agricole SA Crdit Agricole SA   equity stocks 
2020-03-27, ACA
2020-03-27,ACA enters an Uptrend because Momentum Indicator exceeded the 0 level on March 26 2020 View odds for this and other indicators  Arcosa stockmarket stock technicalanalysis money trading investing daytrading news today 
2020-03-27,20 DMA Support today PLNT LCTX FINV ARCE ATSG YRCW JD CIEN SSYS LKCO INS KLIC BPT BX AAWW ACA SLP MX RMNI MNTA  
2020-03-26,On our Top 50 Bullish List today PFNX INO NVAX BDTX NEM SPAQ WST ZS TWST ACA  
2020-03-26,cryptocurrency blockchain asset fund KR1 invests in Polkadot stablecoin project  ACA 
2020-03-26,ACAs 10day Moving Average broke below its 50day Moving Average on February 26 2020 View odds for this and other indicators  Arcosa stockmarket stock technicalanalysis money trading investing daytrading news today 
2020-03-26,Todays Free Feature Stock Ideas Kroger added to value rankings grocery chains worth a look during pandemic KR GDOT WDR SCHW ACA  grocerychains retailers pandemic value leaders rankings investors
2020-03-25,Scan results  Shooting Star Candlestick today MAIN SLRC DNKN HUBS CBRL GSBD BFAM AJG ELS SRI STZ IRWD AVGO RS MDU LULU DXC GDOT ACA ANET  
2020-03-25,Scan results  Shooting Star Candlestick today MAIN SLRC DNKN CBRL GSBD HUBS BFAM AJG SRI STZ IRWD ELS AVGO RS MDU LULU DXC ACA ANET TRHC  
2020-03-25,CrditAgricole Nos consignes de vote pour lassemble des actionnaires  via  ACA CAC AG2020 corpgov
2020-03-25,ACAs price moved below its 50day Moving Average on February 21 2020 View odds for this and other indicators  Arcosa stockmarket stock technicalanalysis money trading investing daytrading news today 
2020-03-24,All the investments now on Stash A AA AAL AAN AAON AAP AAPL AAT AAWW AAXN ABBV ABC ABCB ABG ABM ABMD ABT ACA ACAD ACB ACC ACGL ACHC ACIA ACIW ACM ACN ADBE ADC ADI ADM ADNT ADP ADS ADSK ADSW ADT ADUS AEE AEIS AEL AEO AEP AERI 1 
2020-03-24,ACA  Arcosa files form DEF 14A 
2020-03-24,ACA enters a Downtrend because Momentum Indicator dropped below the 0 level on February 20 2020 View odds for this and other indicators  Arcosa stockmarket stock technicalanalysis money trading investing daytrading news today 
2020-03-24,ACA CREDITAGRICOLE  15 min Agricole La tendance haussire est actuellement trs forte sur CREDIT AGRICOLE Tant que le cours se maintient au dessus du support  6615 EUR on pourrait chercher  profiter de lenvole Le premier objectif 
2020-03-24,ACA CREDITAGRICOLE  15 min La tendance haussire est actuellement trs forte sur CREDIT AGRICOLE Tant que le cours se maintient au dessus du support  6615 EUR on pourrait 
2020-03-24,Oh no Ive done dragged myself into another cheap conglomerate industrial company ACA 
2020-03-24,The negative oil price situation has me thinking do you keep crude idly stored in rail cars waiting to be processed If so lets take a look at TRNI liked it a lot better pre split with ACA 
2020-03-23,DA Davidson Trims Arcosa ACA Target Price to 4000  markets
2020-03-23,ACAs in Downtrend Moving Average Convergence Divergence MACD Histogram crosses below signal line View odds for this and other indicators  Arcosa stockmarket stock technicalanalysis money trading investing daytrading news today 
2020-03-23,Sur des titres ultra baissiers comme les bancaires je surveille lventuelle cassure dun range par le haut Ici Crdit agricole et les 697 ACA 
2020-03-23,France Stocks Franais Bourse Hospitality AC 93 BFS ACA 51 Software DSY 87Electrical eqp SU 73 Semiconductor STM 9 Luxury MC 27 Media VIV 43Aerospace AIR 9 BioTech BIM 6 Energy FTI 16 SocketSwitches LR 47 Flooring TKTT 62
2020-03-23,Insider Buying Arcosa Inc ACA CEO Purchases 45105000 in Stock  stocks
2020-03-23,Insider Buying Arcosa Inc ACA CEO Purchases 45105000 in Stock 
2020-03-23,Insider Buying Arcosa Inc ACA CEO Purchases 15000 Shares of Stock 
2020-03-22, Etou me preparando ainda aca HuEhUe
2020-03-22,ACAs in Downtrend Moving Average Convergence Divergence MACD Histogram crosses below signal line View odds for this and other indicators  Arcosa stockmarket stock technicalanalysis money trading investing daytrading news today 
2020-03-22,DA Davidson Lowers Arcosa ACA Price Target to 4000  stocks
2020-03-22,DA Davidson Lowers Arcosa ACA Price Target to 4000 
2020-03-22,Antonio Carrillo Buys 15000 Shares of Arcosa Inc ACA Stock 
2020-03-22,Arcosa Inc ACA CEO Antonio Carrillo Buys 15000 Shares 
2020-03-22,ACA this insider transaction catches my eye 
2020-03-21,ACAs in Downtrend Moving Average Convergence Divergence MACD Histogram crosses below signal line View odds for this and other indicators  Arcosa stockmarket stock technicalanalysis money trading investing daytrading news today 
2020-03-21,Arcosa Inc ACA CEO Antonio Carrillo Acquires 15000 Shares of Stock 
2020-03-21,Arcosa ACA Reaches New 1Year Low at 2814 
2020-03-21,ACA  Arcosa Inc Our Artificial Intelligence has predicted this equity has an undetermined short term setup and has a neutral long term outlook Finance Equity money
2020-03-21,ACA new insider buying 15000 shares 
2020-03-21,Wondering about risks of ACA The 63day volatility is 3651 
2020-03-21,ACA  Arcosa Inc 
2020-03-20,Insider Antonio Carrillo reports buying 15000 shares of ACA for a total cost of 45103030 
2020-03-20,Scan results  Bullish Engulfing today ACA  
2020-03-20, Working on a plan with my team  to help aid businesses transitioning their employees to work at home aca anything helps
2020-03-20,ACA enters a Downtrend as Momentum Indicator dropped below the 0 level on February 20 2020 View odds for this and other indicators  Arcosa stockmarket stock technicalanalysis money trading investing daytrading news today 
2020-03-20,Arcosa ACA Price Target Cut to 4000 by Analysts at DA Davidson 
2020-03-19,New 52 Week Low today XERS YMAB ADES ACA ALEX CCO AIRI PATK AIRTP  
2020-03-19,ACAs in Downtrend Moving Average Convergence Divergence MACD Histogram just turned negative View odds for this and other indicators  Arcosa stockmarket stock technicalanalysis money trading investing daytrading news today 
2020-03-19,crditagricole ACA Rebond violent sur 6
2020-03-18,ACA enters a Downtrend because Momentum Indicator dropped below the 0 level on February 20 2020 View odds for this and other indicators  Arcosa stockmarket stock technicalanalysis money trading investing daytrading news today 
2020-03-18, Toda La Vida Fue igual es el pionero Junto A la Amada SU q Gana ACA Y LOS LLEVA AFUERA UNOS PATRIOTAS
2020-03-18,ACA CREDITAGRICOLE  15 min Agricole CREDIT AGRICOLE sinscrit dans une tendance haussire Les traders pourraient envisager de ne traiter que les positions longues  lachat tant que le cours reste bien situ au dessus de 6349 EUR La 
2020-03-18,ACA CREDITAGRICOLE  15 min CREDIT AGRICOLE sinscrit dans une tendance haussire Les traders pourraient envisager de ne traiter que les positions longues  lachat tant que 
2020-03-17,Outside Day today VSTM EL ACA  
2020-03-17,ACA enters a Downtrend as Momentum Indicator dropped below the 0 level on February 20 2020 View odds for this and other indicators  Arcosa stockmarket stock technicalanalysis money trading investing daytrading news today 
