Date,Text_clean
2020-10-12,New 52week highs in the SampP 1500144AAAONAAWWACAADMAGCOAJGAMEDAOSAPHAVGOAWKBIOBLDBLDRBLKBLLBMIBSIGCATCCSCDAYCHTRCLCORCOSTCPRTCRLCTASCTBCTSHCTVADARDEDECKDHRDIODDRECharts 
2020-10-12,Arcosa acquires Strata Materials for 87M ACA 
2020-10-12,ACA Arcosa announced that it has acquired Strata Materials for approximately 87 mln 
2020-10-12,Recent ACA technical alerts NR72 plus 4 more alerts 
2020-10-12,Popular TWLO AMZN PINS RMR TMO PKI ACA BRP FLXS OSPN SON SPGI GIX
2020-10-12,Signs of things heating up  parachains are coming to KUSAMA  ACA KAR PHA RING PCX XOR XRT please retweet 
2020-10-12,ACA 15s delayed Issued Press Release on October 12 080000 Arcosa Inc Announces the Acquisition of Strata Materials 
2020-10-12,ACA Arcosa Inc Announces the Acquisition of Strata Materials
2020-10-12,Arcosa Inc ACA To Go ExDividend on October 14th 
2020-10-12,Arcosa Inc ACA To Go ExDividend on October 14th  stocks
2020-10-12,Arcosa Inc ACA To Go ExDividend on October 14th 
2020-10-12,Vido AnalyseTechnique Court Terme graph dailyAlstom ALO 49 tramwaysCrditAgricole ACA 25 GNBStratgie jour AXA CS Sous pressionWarrant Put 8142TTurbo Put D139TCac40 Rsistance Warrant Put 7613T Actions Indices Investing Trading 
2020-10-12,31 M BF additions to the Swing watchlist ACA AKAM COUP HEAR AMZN GOOG NFLX MSFT APPL PYPL
2020-10-11,ACA in Uptrend price may jump up because it broke its lower Bollinger Band on September 14 2020 View odds for this and other indicators  Arcosa stockmarket stock technicalanalysis money trading investing daytrading news today 
2020-10-10,ACA in Uptrend price expected to rise as it breaks its lower Bollinger Band on September 14 2020 View odds for this and other indicators  Arcosa stockmarket stock technicalanalysis money trading investing daytrading news today 
2020-10-10,Introducing Karura the DeFi hub of Kusama and sister network of Built with nearly the same codebase as Acala and enabling a scalable userfriendly and fast crosschain DeFi platformDOT KSM ACA
2020-10-09,ACA in Uptrend price may ascend as a result of having broken its lower Bollinger Band on September 14 2020 View odds for this and other indicators  Arcosa stockmarket stock technicalanalysis money trading investing daytrading news today 
2020-10-09,parachains are coming to ksm kusama  ACA  
2020-10-09,So fecking hyped for this one probably the top of my list of Dot and Ksm projects Aca Polkadefi 
2020-10-08,ACA in Uptrend price may jump up because it broke its lower Bollinger Band on September 14 2020 View odds for this and other indicators  Arcosa stockmarket stock technicalanalysis money trading investing daytrading news today 
2020-10-08,En 10 ans les trois grands banques franaise affichent une performance boursire ngativeBNP   2889 ACA   3016 GLE   6849 Le CAC40 performe lui de  3053 Bourse 
2020-10-08,Rose Above Upper Bollinger Band today DK DOX VCTR ACA HOG XT IMTX ARGO ARNC ASH NAV BGB PFE BNS BRBR CAE CBT CMP COR CSL  
2020-10-08,France Stocks Franais Bourse ConsultingTech CAP 4 Airline AF 46 Defense HO 12 BioTech ALNOV 119 REIT LI 49 Software DSY 12 BFS GLE 27 Auto RNO 1 Entertain TCH 17 Electric Utility ENGI 11 Financial svc ACA 23
2020-10-07,Acaban de llamarme a mi telfono fijo para una dizque encuesta para saber por cul partido votar al final me dijeron que Mario Delgado es la mejor opcin por MorenaNo s  quin diablos dio mi nmero De donde aca Mario Delgado para tanta publicidad
2020-10-07,ACA in Uptrend price may ascend as a result of having broken its lower Bollinger Band on September 14 2020 View odds for this and other indicators  Arcosa stockmarket stock technicalanalysis money trading investing daytrading news today 
2020-10-07,AF GLE ACAAlgorithms detecting strong trading convergence are the best way to remove human biasfeelingsdoubts when tradingLatest signals given by our algorithm on these stocks on our 2hours charts stocks nasdaq euronext NYSE   
2020-10-07,Polkadot reveals initial parachain offerings to counter traditional IPOs aca dot via rCryptocurrencyFinance 
2020-10-06,Arcosa Announces Timing of Third Quarter 2020 Earnings Release and Conference Call ACA 
2020-10-06,ACA in Uptrend price expected to rise as it breaks its lower Bollinger Band on September 14 2020 View odds for this and other indicators  Arcosa stockmarket stock technicalanalysis money trading investing daytrading news today 
2020-10-06,ACA Arcosa Inc Announces Timing of Third Quarter 2020 Earnings Release and Conference Call 
2020-10-06,ACA 15s delayed Issued Press Release on October 06 161500 Arcosa Inc Announces Timing of Third Quarter 2020 Earnings Release and Conference Call 
2020-10-06,ACA 15s delayed acc90 always check Earnings Release October 06 161500 
2020-10-06,ACA Arcosa Inc Announces Timing of Third Quarter 2020 Earnings Release and Conference Callearnings
2020-10-06,Rose Above Upper Bollinger Band today LMPX RIGL AMWD EVFM ACA AVK NI NBEV NTST CSB  
2020-10-06,BNP ACA ont cass il y a quelques semaines un triangle symtrique  la baisse en daily Nen parlons pas de la SocGen car il y a une personne qui en rigole 
2020-10-05,ACA in Uptrend price may ascend as a result of having broken its lower Bollinger Band on September 14 2020 View odds for this and other indicators  Arcosa stockmarket stock technicalanalysis money trading investing daytrading news today 
2020-10-05,ACA Credit Agricole SA  Banque Federative Du Credit Mutuel  Mergers Acquisitions MA Partnerships Alliances And Investments Summary Marketlines Banque Federative Du Credit Mutuel Mergers amp Acquisitions MampA Partnerships amp  equity stocks 
2020-10-04,ACA in Uptrend price may ascend as a result of having broken its lower Bollinger Band on September 14 2020 View odds for this and other indicators  Arcosa stockmarket stock technicalanalysis money trading investing daytrading news today 
2020-10-03,ACA in Uptrend price expected to rise as it breaks its lower Bollinger Band on September 14 2020 View odds for this and other indicators  Arcosa stockmarket stock technicalanalysis money trading investing daytrading news today 
2020-10-03,ACA We estimate that roughly half of our end markets are related to infrastructure with the other half split across residential nonresidential and specialty markets he says
2020-10-03,ACA 
2020-10-03,ACA  
2020-10-02,ACAs 10day Moving Average broke below its 50day Moving Average on September 23 2020 View odds for this and other indicators  Arcosa stockmarket stock technicalanalysis money trading investing daytrading news today 
2020-10-02,Reversed from Down today ZUMZ MGA MANT WHR HPP CFX OHI SFBS EQR KEX SRC RDSA ARW KIM EWL CSTM NXTC WEX CASH ACA  
2020-10-02,France Stocks Franais Bourse Financial svc ACA 24 FinTech WLN 19 Auto RNO 17 OpticsGlassware EL 16 Defense SAF 23 Hospitality AC 24 BioPharma DBV 22 Luxury MC 15 Airline AF 21 Software DSY 19 Bank BNP 18
2020-10-02,ACA CREDITAGRICOLE  Hebdomadaire Agricole Tous les lments tant clairement baissiers il serait possible pour les traders de ne traiter que les positions shorts  la vente sur CREDIT AGRICOLE tant que le cours reste bien situ sous 8542 
2020-10-02,ACA CREDITAGRICOLE  Hebdomadaire Tous les lments tant clairement baissiers il serait possible pour les traders de ne traiter que les positions shorts  la vente sur CREDIT 
2020-10-02,ACANew Insider Filing on Arcosa IncsPresident amp CEOANTONIO CARRILLO
2020-10-02,ACANew Insider Filing on Arcosa IncsDirectorJOHN W LINDSAY
2020-10-02,  UdeG Entre este cuate y el inepto gobernadorcito tamos fregadosYa veremos al gober cuando se postule a la presidencia de donde aca tanto recuro Guarden este tuit
2020-10-02,ACANew Insider Filing on Arcosa IncsDirectorRONALD J GAFFORD
2020-10-02,ACANew Insider Filing on Arcosa IncsDirectorDOUGLAS L ROCK
2020-10-01,ACANew Insider Filing on Arcosa IncsDirectorDAVID W BIEGLER
2020-10-01,ACA 15s delayed filed SEC form 4 Director ROCK DOUGLAS L Transacted Derivative Securities on 20200930  
2020-10-01,ACA 15s delayed filed SEC form 4 Director LINDSAY JOHN W Transacted Derivative Securities on 20200930  
2020-10-01,ACA 15s delayed filed SEC form 4 Director GAFFORD RONALD J Transacted Derivative Securities on 20200930  
2020-10-01,ACA 15s delayed filed SEC form 4 President amp CEO Carrillo Antonio Transacted Derivative Securities on 20200930  
2020-10-01,ACA 15s delayed filed SEC form 4 Director BIEGLER DAVID W Transacted Derivative Securities on 20200930  
2020-10-01,DELLALBACATECHFMSTTTKRBLKPCARLANCBPMCCREERETATRMBMIMEUTHRQLYSCWSTWKPGRIPGPRMDBYDSEMGRUBGOLFSHWBROSSRMBRKSSVMKWDAYTIFCRUSSRCLPHMSNXCTASEQTIRBTFELEBERYZBRAITWOSBLINETNUNPPOWIFMC
2020-10-01,ACAs 10day Moving Average broke below its 50day Moving Average on September 23 2020 View odds for this and other indicators  Arcosa stockmarket stock technicalanalysis money trading investing daytrading news today 
2020-10-01,Rose Above 50 DMA today NXTC IIIN ACA  
2020-10-01,CMIDEHLIEQIXLLYWSMTEVAICLRCHDNPRLBTYLNOVTSAPABTHTHTAVGOABBKRSNEGLIBAFSVCPRTZTSWITDGKKRPLANAAONAMGNIRESTCMASRBCAQUADELLALBACATECHFMSTTTKRBLKPCARLANCBPMCCREERETATRMBMIMEUTHR
2020-10-01,ACA short interest ratio on 20190531 is 363 
2020-10-01,If you invest 1000 in LMT today at 38328 per share and the stock prices rebound back to prepandemic prices at 43785 your investment would be worth 114238 Thats 14 growth and 14238 profit  See more   OXLC TSCBP ACA COFF CHWY
2020-10-01, KSM silently evolvingits gonna take the market by surprise imo pcx aca and moonbeam
2020-10-01,Top 5 defi players building on Polka dot  aca ocean om rfuel pols 
2020-09-30,ACA in Uptrend price may ascend as a result of having broken its lower Bollinger Band on September 14 2020 View odds for this and other indicators  Arcosa stockmarket stock technicalanalysis money trading investing daytrading news today 
2020-09-30,Tableau de bord SBF120Mensuel  Septembre 202030092020 vs 31082020bourse cac40 sbf120MMB S30 TRI POM GNFT RCO UBI ATE KER SOI SEV SPIE UG MT TKTTVK CGG ERA AF URW ELIOR GLE KN FTI BNP RUI LI ACA SAF MERY 
2020-09-30,Rose Above 50 DMA today HRI LZB ETH HHC RHI SQM ACA SCPE BMO AL MIME AMED VLRS BBDC GXGX IWR AMBC AIA BKU CATO  
2020-09-30,KSM  is the one that is silently taking the crypto space by storm It contains every sensibility of the ethos of explorationthat will lead to the discovery of value DYOR Ethereum dot btc atom link xrp eos defi aca 
2020-09-29,Factbox Trump Biden healthcare differences in spotlight amid pandemic Supreme Court fight ACA 
2020-09-29,ACA enters an Uptrend as Momentum Indicator exceeded the 0 level on September 28 2020 View odds for this and other indicators  Arcosa stockmarket stock technicalanalysis money trading investing daytrading news today 
2020-09-29,Rose Above 50 DMA today IMXI ACA CEMI  
2020-09-29,Voir Vido AnalyseTechnique Court Terme graph dailyArcelorMittal MT CessionDaimler DAI DZetsche renonceStratgie jour CrditAgricole ACA Cassure supportWarrant Put 9084TTurbo Put A430TDAX BaissierWarrant Put 0743TCac40 Actions Indices Trading 
2020-09-28,ACAs price moved below its 50day Moving Average on September 21 2020 View odds for this and other indicators  Arcosa stockmarket stock technicalanalysis money trading investing daytrading news today 
2020-09-28,Rose Above 50 DMA today ACBI ACA BCEI FYC QQXT  
2020-09-28,With riskofloss gauges overheating in March and Spring capital requirements for marketmaking activities at the Eurozones GSibs surged by a third during the first half of the yearBNP GLE UCG KN ACA INGA SAN DBK
2020-09-28,France Stocks Franais Bourse Auto RNO 63 Financial svc ACA 51 Luxury MC 11 Energy FP 2 Semiconductor STM 21 Defense HO 15 Software DSY 2 Tire ML 24 Advertising PUB 29 Airline AF 11 Food BN 11 Personal care OR 21
2020-09-28,ACA CREDITAGRICOLE  1H Agricole La tendance baissire est actuellement trs forte sur CREDIT AGRICOLE Tant que le cours se maintient en dessous de la rsistance  7304 EUR on pourrait chercher  profiter du rallye baissier Le premier 
2020-09-28,Se llama Boal Etatal Vicarrita i aca la entrevita te corto la publiidad del Etado y te envo la unat 
2020-09-27,ACAs price moved below its 50day Moving Average on September 21 2020 View odds for this and other indicators  Arcosa stockmarket stock technicalanalysis money trading investing daytrading news today 
2020-09-27, Acala ACA Price 050717Holders 9Pools 50 WETH  34654 ACAMint date 09252020
2020-09-26,ACAs price moved below its 50day Moving Average on September 21 2020 View odds for this and other indicators  Arcosa stockmarket stock technicalanalysis money trading investing daytrading news today 
2020-09-26,Polkadot DeFi An introduction to AcalaPolkadot DeFi stablecoinDOT ACA
2020-09-26, UNII irdrop Get 50 UNII  50Reff Rate GoodHAPPY EARNINGS Airdrop altcoin defi huobi ICO criptoADA ZIL  TRX  AGI PNT EOS XZC FLETA UNI LINK XRP HEX XTZ SXP  ACA AVAX BEPRO XPR VID DGB VIDT XVG ALGO
2020-09-26,  UNII irdrop Get 50 UNII  50Reff Rate GoodHAPPY EARNINGS Airdrop altcoin defi huobi ICO criptoADA ZIL  TRX  AGI PNT EOS XZC FLETA UNI LINK XRP HEX XTZ SXP  ACA AVAX BEPRO XPR VID DGB VIDT XVG ALGO
2020-09-26,ACA CREDITAGRICOLE  1H La tendance baissire est actuellement trs forte sur CREDIT AGRICOLE Tant que le cours se maintient en dessous de la rsistance  7304 EUR on 
2020-09-26,  YYFI Protocol Airdrop is live Get 005 YYFI 1 YYFI  500Link Airdrop  huobi  binanceADA ZIL FTM TRX  AGI PNT EOS XZC FLETA UNI LINK XRP HEX XTZ SXP ERD ETH  ES  ACA AVAX  XPR VID DGB VIDT XVG
2020-09-26,  YYFI Protocol Airdrop is live Get 005 YYFI 1 YYFI  500Link Airdrop  huobi  binanceADA ZIL FTM TRX  AGI PNT EOS XZC FLETA UNI LINK XRP HEX XTZ SXP ERD ETH  ES  ACA AVAX  XPR VID DGB VIDT XVG
2020-09-26,  YYFI Protocol Airdrop is live Get 005 YYFI 1 YYFI  500Link Airdrop  huobi  binanceADA ZIL FTM TRX  AGI PNT EOS XZC FLETA UNI LINK XRP HEX XTZ SXP ERD ETH  ES  ACA AVAX  XPR VID DGB VIDT XVG
2020-09-26,  YYFI Protocol Airdrop is live Get 005 YYFI 1 YYFI  500Link Airdrop  huobi  binanceADA ZIL FTM TRX  AGI PNT EOS XZC FLETA UNI LINK XRP HEX XTZ SXP ERD ETH  ES  ACA AVAX  XPR VID DGB VIDT XVG
2020-09-26,  YYFI Protocol Airdrop is live Get 005 YYFI 1 YYFI  500Link Airdrop  huobi  binanceADA ZIL FTM TRX  AGI PNT EOS XZC FLETA UNI LINK XRP HEX XTZ SXP ERD ETH  ES  ACA AVAX  XPR VID DGB VIDT XVG
2020-09-26,  YYFI Protocol Airdrop is live Get 005 YYFI 1 YYFI  500Link Airdrop  huobi  binanceADA ZIL FTM TRX  AGI PNT EOS XZC FLETA UNI LINK XRP HEX XTZ SXP ERD ETH  ES  ACA AVAX  XPR VID DGB VIDT XVG
2020-09-26, YYFI Protocol Airdrop is live Get 005 YYFI 1 YYFI  500Link Airdrop  huobi  binanceADA ZIL FTM TRX  AGI PNT EOS XZC FLETA UNI LINK XRP HEX XTZ SXP ERD ETH  ES  ACA AVAX  XPR VID DGB VIDT XVG ALGO
2020-09-26, io  YYFI Protocol Airdrop is live Get 005 YYFI 1 YYFI  500Link Airdrop altcoin defi deFi huobi ICO cripto binanceADA ZIL FTM TRX MEMEBEAM AGI PNT EOS XZC FLETA UNI LINK XRP HEX XTZ SXP ERD ETH MOONB ES WNXM ACA
2020-09-26,Arcosa Inc ACA Given Average Rating of Buy by Analysts 
2020-09-26,  YYFI Protocol Airdrop is live Get 005 YYFI 1 YYFI  500Link Airdrop  huobi  binanceADA ZIL FTM TRX  AGI PNT EOS XZC FLETA UNI LINK XRP HEX XTZ SXP ERD ETH  ES  ACA AVAX  XPR VID DGB VIDT XVG ALGO
2020-09-26,  YYFI Protocol Airdrop is live Get 005 YYFI 1 YYFI  500Link Airdrop  huobi  binanceADA ZIL FTM TRX  AGI PNT EOS XZC FLETA UNI LINK XRP HEX XTZ SXP ERD ETH  ES  ACA AVAX  XPR VID DGB VIDT XVG ALGO
2020-09-25,ACAs 10day Moving Average moved below its 50day Moving Average on September 23 2020 View odds for this and other indicators  Arcosa stockmarket stock technicalanalysis money trading investing daytrading news today 
2020-09-25,Retrouvez lintgralit de nos changes dhier avec les internautes et   Revenu Agricole banques conomie ACA
2020-09-25,France Stocks Franais Bourse Auto UG 38 Financial svc ACA 36 KN 33 Luxury MC 21 Alcohol RI 19 Insurance CS 2 Energy FP 12 Semiconductor STM 33 Pharma SAN 18 FinTech WLN 15 Software DSY 12 Tire ML 19 Aerospace AIR 22
2020-09-25,Otra pregunta cuando va a mencionar a T0ny aca como un ejemplo de mala prctica de gobienro
2020-09-24,ACAs price moved below its 50day Moving Average on September 21 2020 View odds for this and other indicators  Arcosa stockmarket stock technicalanalysis money trading investing daytrading news today 
2020-09-24,Top 3 DeFi projects backed by the infamous crypto VC  with an upcoming public tokensale1  INJ  L2 derivatives exchange protocol2  ACA  decentralized stablecoin platform3   ROSE  network for defi amp open data
2020-09-24,Cette crise nous oblige  acclrer sur le dveloppement de notre projet annonc en juin 2019  ACA
2020-09-24, De donde sacate ee documentoeguro del mismo lugar de donde acate el certificado de nacimiento del supueto hijo de  
2020-09-24,Le systme bancaire est trs solide et de longue date Cest important parce que le rle des banques est de soutenir lconomie et plus encore en temps de crise  ACA
2020-09-24,Crdit Agricole  ciblerait des acquisitions en Italiebourse rumeur finance ACA
2020-09-24,Think of all the great crypto projects waiting for the market to reverse before they release their coins Nobody wants to release in a down trend  Near Protocol NEAR Acala Network ACA Kilt Protocol KILT  Scoop these up as quick as you can once available
2020-09-24,Comparing Gulf Island Fabrication GIFI and Arcosa ACA  stocks
2020-09-24,Comparing Gulf Island Fabrication GIFI and Arcosa ACA 
2020-09-23,ACAs price moved below its 50day Moving Average on September 21 2020 View odds for this and other indicators  Arcosa stockmarket stock technicalanalysis money trading investing daytrading news today 
2020-09-23,ADA ZIL FTM TRX MEMEBEAM AGI PNT EOS HIVE JAR LRC SCGAS QSP TOMO WRX ZEC XZC FLETA UNI  LINK XRP HEX XTZ SXP ERD ETH MOONB ES Protocol WNXM ACA AVAX BEPRO XPR VID GRT INCH DGB AAPL SKL VIDT ELF UNI XVG ALGO 
2020-09-23,ADA ZIL FTM TRX MEMEBEAM AGI PNT EOS HIVE JAR LRC SCGAS QSP TOMO WRX ZEC XZC FLETA UNI  LINK XRP HEX XTZ SXP ERD ETH MOONB ES Protocol WNXM ACA AVAX BEPRO XPR VID GRT INCH DGB AAPL SKL VIDT ELF UNI XVG ALGO 
2020-09-23,Rose Above 50 DMA today PKE PIO LAMR MIDD LMBS TCPC ACA AL AME AZZ CEIX CNO HHC DEX FOF FUL GLEO H NPO PAG  
2020-09-23,BNP ACA ont cass leur triangle symtrique en daily  la baisse GLE SocGen est proche de ses plus bas historiques de mars 2020Ce nest pas bon signe pour lvolution du CAC CAC40  moyen terme qui paie galement sa forte expo sur laronautique et automobile
2020-09-23,Primary Projects Update Sep 23  UNFI UP WOOinfo MW ACA 1INCH NU SKL ROSEBitcoin defi ipfs 
2020-09-23,Des questions sur lactu conomique et financire les impacts du Brexit ou de la crise sanitaire actuelle  Inscrivezvous et posez les  il y rpondra en ligne ce jeudi  partir de 18h30 ACA  Revenu  
2020-09-23, bonding DOT for ACA
2020-09-23,Des questions sur lactu conomique et financire les impacts du Brexit ou de la crise sanitaire actuelle  Inscrivezvous et posez les  il y rpondra en ligne ce jeudi  partir de 18h30 ACA  Revenu  
2020-09-22,ACA in Uptrend price may jump up because it broke its lower Bollinger Band on September 14 2020 View odds for this and other indicators  Arcosa stockmarket stock technicalanalysis money trading investing daytrading news today 
2020-09-22,ADA ZIL FTM TRX MEMEBEAM AGI PNT EOS HIVE JAR LRC SCGAS QSP TOMO WRX ZEC XZC FLETA UNI  LINK XRP HEX XTZ SXP ERD ETH MOONB ES Protocol WNXM ACA AVAX BEPRO XPR VID GRT INCH DGB AAPL SKL VIDT ELF UNI XVG ALGO 
2020-09-22,ADA ZIL FTM TRX MEMEBEAM AGI PNT EOS HIVE JAR LRC SCGAS QSP TOMO WRX ZEC XZC FLETA UNI  LINK XRP HEX XTZ SXP ERD ETH MOONB ES Protocol WNXM ACA AVAX BEPRO XPR VID GRT INCH DGB AAPL SKL VIDT ELF UNI XVG ALGO 
2020-09-22,Rose Above 50 DMA today BZH VSEC NARI WALA ACA MTNB FTV MREO NMFC SRET ECL IMAX FCPT HR SAFE TACO  
2020-09-22,aca Jessaie de rentrer a 771 Boll inf explose Stop  757 plus bas hier je tente un retour milieu de boll
2020-09-22,ADA ZIL FTM TRX MEMEBEAM HIVE MTL EOS HIVE MCO LRC ZRX GAS QSP TOMO WRX ZEC FOTA FLETA UNI  LINK XRP HEX HOT SXP ERD ETH MOONB ES Protocol SNTVT ACA AVAX CODA CQT FIL GRT INCH NEAR  SKL AAPL ELF UNI XVG CHR 
2020-09-22,news ACA
2020-09-22,Here are some of the most anticipated nontradable coins yet coins should be listed in 2020 Acala ACA Avalanche AVAX Coda Protocol CODA Covalent CQT Filecoin FIL The Graph  GRT 1 inch INCH NEAR NEAR NuCypher NU Skale SKL  
2020-09-22,short ratio interest of ACA is 363 at 20190531 
2020-09-22,ACA provider of infrastructurerelated products for construction energy and transportation markets Bounced off 200d 
2020-09-22,Gulf Island Fabrication GIFI amp Arcosa ACA Financial Analysis 
2020-09-22,Gulf Island Fabrication GIFI amp Arcosa ACA Financial Analysis 
2020-09-22,ADA ZIL FTM TRX TFUEL BEAM HIVE MTL EOS HIVE MCO LRC ZRX GAS QSP TOMO WRX ZEC FOTA FLETA UNI  LINK XRP HEX HOT SXP ERD ETH MOONB ES Protocol SNTVT ACA AVAX CODA CQT FIL GRT INCH NEAR NU SKL AAPL ELF UNI XVG 
2020-09-21,ADA ZIL FTM TRX TFUEL BEAM HIVE MTL EOS HIVE MCO LRC ZRX GAS QSP TOMO WRX ZEC FOTA FLETA UNI  LINK XRP HEX HOT SXP ERD ETH MOONB ES Protocol SNTVT ACA AVAX CODA CQT FIL GRT INCH NEAR NU SKL AAPL ELF UNI XVG 
2020-09-21,Acala ACA Avalanche AVAX Coda Protocol CODA Covalent CQT Filecoin FIL The Graph GRT 1inch INCH NEAR NEAR NuCypher NU Skale SKLGood work Analytics  
2020-09-21,Updated list of some the most expected not yet tradable coins All the coins expected to get listed in 2020 In alphabetical order Acala ACA Avalanche AVAX Coda Protocol CODA Covalent CQT Filecoin FIL The Graph GRT 1inch INCH NEAR NEAR NuCypher NU Skale SKL 
2020-09-21,ACA in Uptrend price may ascend as a result of having broken its lower Bollinger Band on September 14 2020 View odds for this and other indicators  Arcosa stockmarket stock technicalanalysis money trading investing daytrading news today 
2020-09-21,aca 
2020-09-21,France Stocks Franais Bourse Hospitality AC 63 Insurance CS 41 Bank BNP 6 Electric Utility ENGI 28 Personal care OR 17 Luxury KER 29 Software DSY 15 Financial svc ACA 53 Defense HO 43 Aircraft AM 51 Glass SGO 4
2020-09-21, Banco Santander Largest Equity in IBEX 35 at 15  Barclays now a penny stock the retail banks will be sacrificed by control structure at the turning imv Take a Look at Credit Agricole ACA its EU wide  
2020-09-21,Des questions sur lactu conomique et financire les impacts du Brexit ou de la crise sanitaire actuelle  Inscrivezvous et posez les  il y rpondra en ligne ce jeudi  partir de 18h30 ACA  Revenu  
2020-09-21,reddit  Acala Network Review  Polkadot Blockchain Bedrock DeFi Protocol  DOT ACA 
2020-09-20,ACA in Uptrend price may jump up because it broke its lower Bollinger Band on September 14 2020 View odds for this and other indicators  Arcosa stockmarket stock technicalanalysis money trading investing daytrading news today 
2020-09-20,ACA short ratio on 20190531 is 363 
2020-09-19,ACA in Uptrend price may ascend as a result of having broken its lower Bollinger Band on September 14 2020 View odds for this and other indicators  Arcosa stockmarket stock technicalanalysis money trading investing daytrading news today 
2020-09-19,   Parachains are coming to DOT and KSM Native parachain tokens like aca plm etc will drain even more of the DOT and KSM supply We havent even mentioned interop    ecosystem is moon bound 
2020-09-19,HeadToHead Comparison Arcosa ACA versus Gulf Island Fabrication GIFI  markets
2020-09-19,ACA CREDITAGRICOLE  Journalier Agricole On peut voir  court terme une acclration de la tendance baissire de fond sur cette unit de temps pour CREDIT AGRICOLE Cest un signal positif pour les vendeurs Tant que le cours se maintient sous 
2020-09-19,ACA CREDITAGRICOLE  Journalier On peut voir  court terme une acclration de la tendance baissire de fond sur cette unit de temps pour CREDIT AGRICOLE Cest un signal 
2020-09-18,This is easily one of my favourite crypto startups right now I have a lot of respect for this team and I dont need to own ACA or be paid to say that Read into  if you havent even VCsVentureDAOs from the ethereum eco early investment circle jumped into it 
2020-09-18,ACA in Uptrend price may jump up because it broke its lower Bollinger Band on September 14 2020 View odds for this and other indicators  Arcosa stockmarket stock technicalanalysis money trading investing daytrading news today 
2020-09-18,Actualizo ACA y BNP donde marcabamos 2 triangulos en los bancos franceses la semana pasada hoy rotos a la baja Ambos objetivos dibujados en el grafico EUROSTOXX50 Francia CAC40 trading  
2020-09-18,LEAS  52 week high volume on the weekly chart 110 this week LINK ERD LTC BTC ETH DOT KSM EWT DGB ADA BNB EOS DAPS XTZ VET ATOM BTC ETH ETC XRP BCH BSV ADA LTC CRO BNB EOS LINK XTZ XLM HEX XMR TRX LEO VET NEO DASH ZEC ACA MKR ONT XEM 
2020-09-18,20 DMA Support today NUVA PRFT ROCK TCOM ULH RDN ACA PSEC THW SPYD LORL NULV SPYV HGLB RNP VLUE SCHV GL MSGE TRC  
2020-09-18,Arcosa ACA amp Proto Labs PRLB Critical Contrast  stocks
2020-09-18,Arcosa ACA amp Proto Labs PRLB Critical Contrast 
2020-09-18,Les bancaires continuent de dvisser risquant ainsi de faire reculer le CAC  CreditAgricole sort par le bas de son triangle ACA BNP se trouve  la croise des chemins et tente de sauver la borne basse de son triangle BNP SocitGnrale  Sortie de diamant GLE 
2020-09-17,If you wanna keep up with  read  s write up I REALLY wish I had asked to invest in this when I interviewed em I havent invested in early allocs in yrs but WOW I wish I had asked  when I spoke with her  I believe in this crypto ACA 
2020-09-17,ACA in Downtrend Stochastic indicator sits in oversold zone for 4 days View odds for this and other indicators  Arcosa stockmarket stock technicalanalysis money trading investing daytrading news today 
2020-09-17,LEAS  New high of day 13243 at 0043 LEO VET NEO DASH ZEC ACA MKR ONT XEM INO DOGE BAT DAI DGB ZRX BTT ALGO BTC ETH ETC XRP BCH BSV ADA LTC CRO BNB EOS LINK XTZ XLM HEX XMR TRX LINK ERD LTC BTC ETH DOT 
