Date,Text_clean
2020-08-04,Arcosa ACA Price Target Increased to 6100 by Analysts at Susquehanna Bancshares  markets
2020-08-04, surveiller SNCLavalin peut encore se mettre en  valeur SNC Telus accrot le plus son actif net son titre devrait en tenir compte T la faiblesse dAir Canada reflte la frustration envers les restrictions fdrales ACa Lesaffairescom  
2020-08-04, REPLAY  En attendant les chiffres et les rsultats du 2me trimestre flash back sur 3 mois marqus par la crise du Covid19 mais pas uniquement ACA RsultatsCA FR CIB       Ita 
2020-08-03,ACA in Uptrend price expected to rise as it breaks its lower Bollinger Band on July 9 2020 View odds for this and other indicators  Arcosa stockmarket stock technicalanalysis money trading investing daytrading news today 
2020-08-02,ACA in Uptrend price may ascend as a result of having broken its lower Bollinger Band on July 9 2020 View odds for this and other indicators  Arcosa stockmarket stock technicalanalysis money trading investing daytrading news today 
2020-08-02,Watchlist CT de la semaine du 3 aot  ORDI APAM SIGHT ALLEX ALENE DLTA ACA BOL ALBPS BCART ALCLS KORI ADP DGM EN EOSI CLA ALGBE  SX VEON SEFER
2020-08-02,        ACA DOT KSM 
2020-08-01,ACA in Uptrend price may ascend as a result of having broken its lower Bollinger Band on July 9 2020 View odds for this and other indicators  Arcosa stockmarket stock technicalanalysis money trading investing daytrading news today 
2020-08-01,  Con mi bodo vamos aca el pick bro
2020-08-01,Arcosa ACA Posts Earnings Results Beats Expectations By 013 EPS 
2020-08-01,Arcosa Inc ACA held an earnings call on 7312020 Here are the highlights
2020-07-31,ACAs price moved above its 50day Moving Average on July 10 2020 View odds for this and other indicators  Arcosa stockmarket stock technicalanalysis money trading investing daytrading news today 
2020-07-31,Scan results  Hammer Candlestick today TEAM SPAQ TDS PFG EXPE AMCR ALB SGEN TXN CP TOT ACA UNP MSFT WH FFIV SYK KW PAYX APD  
2020-07-31,ACA Earnings Intelligence Analysis of recent earnings identified Arcosa s ACA business focus on capitalcashcyclicalitylongterm capitalcashlongterm cashcyclicalitylongterm
2020-07-31,ACA  Arcosa Inc ACA CEO Antonio Carrillo on Q2 2020 Results  Earnings Call Transcript  trading markets stockmarket
2020-07-31,ACA  Arcosa Inc 2020 Q2  Results  Earnings Call Presentation  stocks investing finance
2020-07-31,ACA  Arcosa files form 10Q 
2020-07-31,SEC Form 10Q Quarterly Report filed by  ACA Arcosa Inc  
2020-07-31,ACA  10Q  Arcosa   31 Jul 1133am 2020 Q2 EarningsACA 10Q Arcosa Earnings
2020-07-31,ACA 15s delayed filed form 10Q on July 31 113304 
2020-07-31,Outside Day today LOV GSB EYE MWK ONEM BWG AMRC ACA BFAM CXP HNGR  
2020-07-31,ACA The long and short term trends are both positive This is looking good  
2020-07-31,ACA  Arcosa files form 8K  Financial Statements and Exhibits Results of Operations and Financial Condition   8K 
2020-07-31,Arcosa Announces Second Quarter 2020 Results ACA ACA 
2020-07-31,ACA Arcosa beats by 008 beats on revs  Reports Q2 Jun earnings of 068 per share 008 better than the SampP Capital IQ Consensus of 060 revenues rose 148 yearyear to 4985 mln vs the 4877 mln SampP
2020-07-31,Arcosa EPS beats by 013 beats on revenue ACA 
2020-07-30,ACA Arcosa beats by 008 beats on revs 
2020-07-30,Construction is always a solid foundation for your portfolio heres what we think AAON ACA WMS BLDR PATK TPX PWR MTZ MHK JCI IESC  New free app on Google Play 
2020-07-30,Earnings Arcosa ACA  ActualEPS073 vs EstEPS06 ActualRev4985M vs EstRev4877M 
2020-07-30,ACA Arcosa Inc Announces Second Quarter 2020 Results 
2020-07-30,ACA reported earnings of 068 consensus was 055 via  epsbeat 
2020-07-30,ACAs price moved above its 50day Moving Average on July 10 2020 View odds for this and other indicators  Arcosa stockmarket stock technicalanalysis money trading investing daytrading news today 
2020-07-30,watching at ACA BYND ENSG IDN PAYS PCTY PW VRTXteamjtrader  
2020-07-30,France Stocks Franais Bourse BioPharma DBV 44 Food BN 63 Auto RNA 62 Insurance CS 37 Financial svc ACA 33 Semiconductor STM 27 Glass SGO 28 Bank BNP 31 Telecom ORA 36 ConsultingTech CAP  26 Biotech GNFT 47
2020-07-30,AAPL ACA AIMT  Notable earnings after Thursdays close 
2020-07-30,  KSM AKRO ACA FIS mostly
2020-07-30,short  to float of ACA is 255 at 20190531 
2020-07-29,ACA  Arcosa Q2 2020 Earnings Preview 
2020-07-29,40 BLDR Builders FirstSource Inc41 ADSW Advanced Disposal Services Inc42 TDS Telephone and Data Systems Inc43 ACA Arcosa Inc44 ANAT American National Insurance Company45 BGS BampG Foods Inc46 EGHT 8x8 Inc47 GPI Group 1 Automotive Inc
2020-07-29,ACA in Uptrend price may ascend as a result of having broken its lower Bollinger Band on July 9 2020 View odds for this and other indicators  Arcosa stockmarket stock technicalanalysis money trading investing daytrading news today 
2020-07-29,ISWH 532 at 20 on todays news XRP BCH BSV ADA LTC CRO BNB EOS LINK XTZ XLM HEX XMR TRX LEO VET NEO DASH ZEC ACA MKR ONT XEM INO DOGE BAT DAI DGB ZRX BTT ALGO 
2020-07-29,ISWH green in power hour ISW Holdings Initializes Production of 1MW Proceso S19 Pod5ive Data Center Design for Shipment to 100Megawatt Bit5ive Project  ETH ETC XRP  LEO   ACA MKR ONT XEM INO DOGE BAT DAI DGB ZRX BTT ALGO BTC
2020-07-29,ISWH ISW Holdings Initializes Production of 1MW Proceso S19 Pod5ive Data Center Design for Shipment to 100Megawatt Bit5ive Project  ETH ETC XRP  LEO VET NEO DASH ZEC ACA MKR ONT XEM INO  BTC ETH LINK KMD BNB XRTP LTC BCH BSV
2020-07-29,ISWH has committed to ramping up sales of its Proceso S19 Pod5ive Data Center Pods through initial market penetration as a supplier to Bit5ives 100MW mining hosting facility based in Pennsylvania  ACA MKR ONT XEM INO DOGE BAT DAI DGB ZRX BTT 
2020-07-29,ISWH ISW Holdings Initializes Production of 1MW Proceso S19 Pod5ive Data Center Design for Shipment to 100Megawatt Bit5ive Project   DASH ZEC ACA MKR ONT XEM INO DOGE BAT DAI DGB ZRX BTT ALGO BTC LINK ADA BNB  ERD LTC ETH KODK BTC
2020-07-29,ISWH Production of 1MW Proceso S19 Pod5ive Data Center Design for Shipment to 100Megawatt Bit5ive Project  DAI DGB ZRX BTT ALGO BTC LINK ADA BNB  ERD LTC ETH DOT KSM EWT DGB  ETH ETC XRP  LEO VET NEO DASH ZEC ACA MKR ONT
2020-07-29,ISWH  Initializes Production of 1MW Proceso S19 Pod5ive Data Center Design for Shipment to 100Megawatt Bit5ive Project  ETH ETC XRP  LEO KODK VET NEO DASH ZEC ACA MKR ONT XEM INO DOGE BAT DAI DGB ZRX BTT ALGO BTC LINK ADA
2020-07-29,ISWH ISW Holdings Initializes Production of 1MW Proceso S19 Pod5ive Data Center Design for Shipment to 100Megawatt Bit5ive Project  ETH ETC XRP  LEO VET NEO DASH ZEC ACA MKR ONT XEM INO DOGE BAT DAI DGB ZRX BTT ALGO BTC LINK KODK
2020-07-29,ISWH ISW Holdings Initializes Production of 1MW Proceso S19 Pod5ive Data Center Design for Shipment to 100Megawatt Bit5ive Project  ETH ETC XRP  LEO VET NEO DASH ZEC ACA MKR ONT XEM INO
2020-07-29,ISWH heading for a breakout ISWH Diversifies into Cryptobased Growth   LEO VET NEO DASH ZEC ACA MKR ONT XEM INO DOGE BAT DAI DGB ZRX   BTC
2020-07-29,ISWH put out a lot of news this month LTC BTC ETH DOT KSM EWT DGB ADA BNB EOS DAPS XTZ VET ATOM BTC ETH ETC XRP BCH BSV ADA LTC CRO BNB EOS LINK XTZ XLM HEX XMR TRX LEO VET NEO DASH ZEC ACA MKR ONT XEM INO DOGE 
2020-07-29,ISWH Diversifies into Cryptobased Growth  ETH ETC XRP  LEO VET NEO DASH ZEC ACA MKR ONT XEM INO DOGE BAT DAI DGB ZRX BTT ALGO BTC
2020-07-29,ISWH Diversifies into Cryptobased Growth LEO VET NEO DASH ZEC ACA MKR ONT XEM INO DOGE BAT DAI DGB ZRX BTT ALGO BTC ETH ETC XRP BCH BSV ADA LTC CRO BNB EOS LINK XTZ XLM HEX XMR TRX
2020-07-29,Breaking news from ISWH ZEC ACA MKR ONT XEM INO DOGE BAT DAI DGB ZRX BTT ALGO BCH BSV ADA LTC CRO BNB EOS LINK XTZ XLM HEX XMR TRX 
2020-07-29,ISWH Builds for Revolution AI Crypto Edge AV BTC ETH ETC XRP BCH BSV ADA LTC CRO BNB EOS LINK XTZ XLM HEX XMR TRX LEO VET NEO DASH ZEC ACA MKR ONT XEM INO DOGE BAT DAI DGB ZRX BTT ALGO 
2020-07-29,ISWH Diversifies into Cryptobased Growth LEO VET NEO DASH ZEC ACA MKR ONT XEM INO DOGE BAT DAI DGB ZRX BTT ALGO BTC ETH ETC XRP BCH BSV ADA LTC CRO BNB EOS LINK XTZ XLM HEX XMR TRX 
2020-07-29,ISWH Reaches for the Revolution LINK ERD LTC BTC ETH DOT KSM EWT DGB ADA BNB EOS DAPS XTZ VET ATOM BTC ETH ETC XRP BCH BSV ADA LTC CRO BNB EOS LINK XTZ XLM HEX XMR TRX LEO VET NEO DASH ZEC ACA MKR ONT XEM INO 
2020-07-28,ACA in Uptrend price may ascend as a result of having broken its lower Bollinger Band on July 9 2020 View odds for this and other indicators  Arcosa stockmarket stock technicalanalysis money trading investing daytrading news today 
2020-07-28,CrditAgricole SA solide au premier trimestre  ACA 
2020-07-28,La BCE prolonge sa recommandation aux banques de ne pas verser de dividendes et ne pas procder  des rachats dactions BNP GLE ACA 
2020-07-28,ACA short ratio is 363 at 20190531 
2020-07-27,ACA in Uptrend price expected to rise as it breaks its lower Bollinger Band on July 9 2020 View odds for this and other indicators  Arcosa stockmarket stock technicalanalysis money trading investing daytrading news today 
2020-07-27,Rating Update for Credit Agricole SA ACA 
2020-07-27,Sawgrass Asset Management LLC Takes Position in Arcosa Inc ACA 
2020-07-27,20 DMA Support today CTRE THCB BSL TCOM VIACA BIS ARCE ACA CVGW CFR TOWN NAK CBT BSET FTHY BOE BSTZ CS BWXT GPRK  
2020-07-27, Laurie    org     ACA
2020-07-27, Sir DeFi is not dead you just have to get good and not use an expensive and slow network like Ethereum Use  and  instead It is the future ACA DOT 
2020-07-27,If  choose  as their next IEO it will be a perfect launchpad for ACA  considering the upcoming   enabling transfer of DOT  ACA
2020-07-26,  Polkadot ecosystem is huge Crazy FOMO will happen there not based on thin air but based on what the tech and solutions will revolutionizeDOT EWT KSM XOR ACA PCX EDG RING to name a fewA new era is being built
2020-07-26,ACA in Uptrend price expected to rise as it breaks its lower Bollinger Band on July 9 2020 View odds for this and other indicators  Arcosa stockmarket stock technicalanalysis money trading investing daytrading news today 
2020-07-26,Watchlist CT de la semaine du 27 juillet  SX ALENE SEFER    DLTA ACA BOL ALBPS BCART ALCLS KORI VEON ADP DGM EN EOSI CLA ALGBE  VK OPN 2CRSI
2020-07-26,Polkadot ecosystem is where money will flow like crazyEvery Polkadot related project will wildly rise and its already happening right nowI urge you to do some research about which one why how whenDOT EWT KSM EDG PCX XOR RING ACA 
2020-07-25,few more most hyped defi tokens on the way keep lookingafter YFI crazy run you dont want to miss it any moreCRV  Curve Fianance high supply thoughACA Acala NetworkPSWAP  
2020-07-25,ACA in Uptrend price may ascend as a result of having broken its lower Bollinger Band on July 9 2020 View odds for this and other indicators  Arcosa stockmarket stock technicalanalysis money trading investing daytrading news today 
2020-07-24,ACA in Uptrend price may ascend as a result of having broken its lower Bollinger Band on July 9 2020 View odds for this and other indicators  Arcosa stockmarket stock technicalanalysis money trading investing daytrading news today 
2020-07-23,ACA in Uptrend price expected to rise as it breaks its lower Bollinger Band on July 9 2020 View odds for this and other indicators  Arcosa stockmarket stock technicalanalysis money trading investing daytrading news today 
2020-07-23,Ce qui expliquerait pourquoi les banques europennes patinent La BCE pourrait prolonger sa recommandation de ne pas verser de dividendes En option elles pourraient proposer aux actionnaires un dividende en action BNP GLE ACA
2020-07-23,If you invest 1000 in PFBI today at 1104 per share and the stock prices rebound back to prepandemic prices at 1690 your investment would be worth 153080 Thats 53 growth and 53080 profit  See more   ACA FTXG EQNR AXGN CYTK 
2020-07-22,I love my REN darknode and I really also like ACA Theyll be a powerhouse together  
2020-07-22,ACA in Uptrend price expected to rise as it breaks its lower Bollinger Band on July 9 2020 View odds for this and other indicators  Arcosa stockmarket stock technicalanalysis money trading investing daytrading news today 
2020-07-21,ACA in Uptrend price may ascend as a result of having broken its lower Bollinger Band on July 9 2020 View odds for this and other indicators  Arcosa stockmarket stock technicalanalysis money trading investing daytrading news today 
2020-07-21, Les rsultats des banques franaises approchentLa probabilit de bons rsultats de leurs branches Corporate amp Investment Banking est importante comme GoldmanSachs aux Nous allons effectuer un trade avec objectif HAUSSIER sur GLE SG BNPP et ACA Crdit Agricole
2020-07-21,Rose Above Upper Bollinger Band today EVR PRI MREO ATRI GPP SOLN CRIS INVE FTK BTT CCOI USVM ACA CFB WBT JHX WW PZG ABEV HRI  
2020-07-20,ACA in Uptrend price may jump up because it broke its lower Bollinger Band on July 9 2020 View odds for this and other indicators  Arcosa stockmarket stock technicalanalysis money trading investing daytrading news today 
2020-07-20,The strength of the French banking sector is illustrated by the presence of no less than 3 banks in the Top 5 Agricole in 2nd place it was briefly top in 2004  3rd and  5th Bank CET1 ACA 
2020-07-20,ACA is currently trading in the upper part of its 52 week range which is inline with the index  
2020-07-19,ACA in Uptrend price may ascend as a result of having broken its lower Bollinger Band on July 9 2020 View odds for this and other indicators  Arcosa stockmarket stock technicalanalysis money trading investing daytrading news today 
2020-07-19,Watchlist CT de la semaine du 20 juillet  ADP BOL EN ACA CLA DLTA DGM EOSI OPN VTX ALNOV VEON ALGBE 2CRSI ALVGO ALGEN  BCART VK ALCLS KORI  MBWS
2020-07-19,If you invest 1000 in VCRA today at 2337 per share and the stock prices rebound back to prepandemic prices at 2509 your investment would be worth 107360 Thats 7 growth and 7360 profit  See more   ACA ALX STAY HIFS GRBK
2020-07-18,Analysts Set Arcosa Inc ACA Price Target at 5100  markets
2020-07-18,ACA in Uptrend price may jump up because it broke its lower Bollinger Band on July 9 2020 View odds for this and other indicators  Arcosa stockmarket stock technicalanalysis money trading investing daytrading news today 
2020-07-18, No creo que quiera ese brocalote acaa de regreso Adems que cada da se ve ms hecha pija 
2020-07-17,ACA in Uptrend price expected to rise as it breaks its lower Bollinger Band on July 9 2020 View odds for this and other indicators  Arcosa stockmarket stock technicalanalysis money trading investing daytrading news today 
2020-07-17,  De dnde aca tanta pendejada
2020-07-17,If you invest 1000 in EGRX today at 5128 per share and the stock prices rebound back to prepandemic prices at 5271 your investment would be worth 102789 Thats 3 growth and 2789 profit  See more   GTN DGRE ACA BRMK NTRS 
2020-07-16,ACA in Uptrend price may jump up because it broke its lower Bollinger Band on July 9 2020 View odds for this and other indicators  Arcosa stockmarket stock technicalanalysis money trading investing daytrading news today 
2020-07-16,Arcosa ACA Downgraded to Sell at ValuEngine 
2020-07-16,Rose Above Upper Bollinger Band today CVA HE CECE SFTW IMO LOGC NUVA MFC ETB PCPL ATKR G CPAA HTLD NTUS SXI AVY TLYS HRZN ACA  
2020-07-15,ValuEngine Downgrades Arcosa ACA to Sell  stocks
2020-07-15,ValuEngine Downgrades Arcosa ACA to Sell 
2020-07-15,The Current Ratio of ACA is much better than the industry average of 220  
2020-07-15,ACA in Uptrend price may jump up because it broke its lower Bollinger Band on July 9 2020 View odds for this and other indicators  Arcosa stockmarket stock technicalanalysis money trading investing daytrading news today 
2020-07-15,Rose Above Upper Bollinger Band today ACA NPK EQH CETV RNR NTRSO NTB GNRS  
2020-07-15,Awebada tras ahuevada de los ticos a este gobierno primero fue al presidente de parte de diputados por bocon y ahora a ste herencia de aca 
2020-07-14,ACA in Uptrend price may ascend as a result of having broken its lower Bollinger Band on July 9 2020 View odds for this and other indicators  Arcosa stockmarket stock technicalanalysis money trading investing daytrading news today 
2020-07-14,    No puede ni podr Su labor siempre fue ha sido y ser hacerla de pedo para ver qu aca
2020-07-14,Arcosa ACA Stock Rating Lowered by ValuEngine 
2020-07-14,Arcosa ACA Downgraded by ValuEngine to Sell 
2020-07-14,Investment Analysts Downgrades for July 13th ACA AKBA AOMOY CCRN CNXN DLPN FFIC GEO HMSNF HTBX  markets
2020-07-14,Investment Analysts Downgrades for July 13th ACA AKBA AOMOY CCRN CNXN DLPN FFIC GEO HMSNF HTBX  stocks
2020-07-13,ACA in Uptrend price may jump up because it broke its lower Bollinger Band on July 9 2020 View odds for this and other indicators  Arcosa stockmarket stock technicalanalysis money trading investing daytrading news today 
2020-07-13,Arcosa Inc to Issue Quarterly Dividend of 005 ACA 
2020-07-13,Exdividend  Stocks on 714ABT ABBVAVKAFGFINSACAARRBKUBELFABELFBRABTZBLWBHKBTAMUILEOBSDBHVBGIOBFZHYTBGRBOECIIBDJEGFBGYBFOFRABGTDividendInvesting stock technicalanalysis trading investing
2020-07-13,Arcosa Inc ACA Receives Consensus Recommendation of Hold from Analysts 
2020-07-12,ACA in Uptrend price may jump up because it broke its lower Bollinger Band on July 9 2020 View odds for this and other indicators  Arcosa stockmarket stock technicalanalysis money trading investing daytrading news today 
2020-07-12,Arcosa Inc ACA Plans 005 Quarterly Dividend 
2020-07-11,ACA in Uptrend price expected to rise as it breaks its lower Bollinger Band on July 9 2020 View odds for this and other indicators  Arcosa stockmarket stock technicalanalysis money trading investing daytrading news today 
2020-07-10,ACAs price moved below its 50day Moving Average on July 9 2020 View odds for this and other indicators  Arcosa stockmarket stock technicalanalysis money trading investing daytrading news today 
2020-07-10,Rose Above 50 DMA today CNA HRL RNR NTB CVCO GFF FNKO LOGC ENTA ORAN TLYS ACA SXI  
2020-07-10,France Stocks Franais Bourse Marketing PUB 22 Semiconductor STM 58 Financial svc ACA 13 MF 23 Glass SGO 16 Mining ERA 65 Digital svc LOCAL 56 Advertising DEC 28 ApparelAcc SMCP 2 Electrical RXL 2 Aerospace AIR 19 VK 33
2020-07-10,Crdit Agricole rejoint la Chaire RSE dAudenciabourse finance ACA
2020-07-09,Arcosa Announces Timing of Second Quarter 2020 Earnings Release and Conference Call ACA 
2020-07-09,ACA NEW ARTICLE  Arcosa Inc Announces Timing of Second Quarter 2020 Earnings Release and Conference Call  Get all the latest ACA related news here  
2020-07-09,ACA Arcosa Inc Announces Timing of Second Quarter 2020 Earnings Release and Conference Call 
2020-07-09,ACA 15s delayed acc90 always check Earnings Release July 09 161500 
2020-07-09,ACA 15s delayed Issued Press Release on July 09 161500 Arcosa Inc Announces Timing of Second Quarter 2020 Earnings Release and Conference Call  
2020-07-09,ACA in Downtrend RSI indicator exits overbought zone View odds for this and other indicators  Arcosa stockmarket stock technicalanalysis money trading investing daytrading news today 
2020-07-09,Fell Below 50 DMA today GEF INS SMFG OSK FTS ACA B RNR IOSP G WWW AGCO NOA VPG ACRE UNM KIM NVST UAA USPH  
2020-07-09,     comms jp  Laurie   pcx aca pha
2020-07-08,ACAs in Downtrend Moving Average Convergence Divergence MACD Histogram just turned negative View odds for this and other indicators  Arcosa stockmarket stock technicalanalysis money trading investing daytrading news today 
2020-07-08,200 DMA Support today HCAT LKFN ACA GLPG WCN NESR BFB OI IRET ICUI SYBT LFUS CBIO HCI  
2020-07-07,ACAs in Downtrend Moving Average Convergence Divergence MACD Histogram just turned negative View odds for this and other indicators  Arcosa stockmarket stock technicalanalysis money trading investing daytrading news today 
2020-07-07,On our Top 50 Bearish List today JELD PRLB DCI WOR ACA YORW DISH EHTH AIMC CALA  
2020-07-07,ACA Crdit Agricole Corporate and Investment Bank Arranges the First Green ABCP Note Financing Electric Vehicles  
2020-07-06, Lo que es alucinante es que la noticia de corupcin de tus socios intentes desviar la atencin insultando la inteligencia de los votantes tambin es insultante lo que opina tu compi intereses ocultos  y insultanos con una transfuga aca tu troll y reparte 
2020-07-06,ACAs 10day Moving Average moved above its 50day Moving Average on June 2 2020 View odds for this and other indicators  Arcosa stockmarket stock technicalanalysis money trading investing daytrading news today 
2020-07-06,ACA creditagricole Graph Jour  
2020-07-06,ACAs 10day Moving Average broke above its 50day Moving Average on June 2 2020 View odds for this and other indicators  Arcosa stockmarket stock technicalanalysis money trading investing daytrading news today 
2020-07-06,ACA Credit Agricole SA Credit Agricole  Well placed to deal with the crisis gtCoR trend no detailed guidance but some reassuring elements  The group still has not provided detailed guidance on the CoR for 2020 given persistent and  equity stocks 
2020-07-06,ACA Credit Agricole SA Crdit Agricole  CASA bien positionne face  la crise gtEvolution du CdR pas de guidance chiffre mais des lments dapprciation rassurants  Le groupe se refuse toujours  ce stade  fournir une guidance  equity stocks 
2020-07-05,Invesir   lachat sur les bancaires du CAC BNP ACA CS sauf SG GLEBizarre Pour un pari court terme pourquoi pas mais du point de vue investisseur cette stratgie  montr son infficacit post crach 2008 
2020-07-05,ACA The long and short term trends are both positive This is looking good  
2020-07-04, Have you bought any ACA And have you checked out BEPRO
2020-07-04, org  Strangely its Top 225 at CMC  seems to have another metric there is a break at 200Top 100 NULS 55 mio market capTop 200 AAC 16 mio mcapTop 201 ACA 14 billion mcapTop 202 HEX 750 mio mcapTop 226 RUNE 72 mio mcapNVM more time to accumulate
2020-07-03,ACAs 10day Moving Average broke above its 50day Moving Average on June 2 2020 View odds for this and other indicators  Arcosa stockmarket stock technicalanalysis money trading investing daytrading news today 
2020-07-03,Arcosa ACA Downgraded by Zacks Investment Research 
2020-07-03,Arcosa ACA Downgraded by Zacks Investment Research 
2020-07-03,Arcosa ACA Downgraded by Zacks Investment Research 
2020-07-02,ACAs 10day Moving Average crossed above its 50day Moving Average on June 2 2020 View odds for this and other indicators  Arcosa stockmarket stock technicalanalysis money trading investing daytrading news today 
2020-07-02,20 DMA Support today ACA NOVN BSCN BIOX APPN NEWT STE NTUS IRET ANIP CAMP AVNS  
2020-07-02,Alternative Energy top REGI REX EOLUBST ACA Selected by our stock screener  stocks  valueinvesting valuation
2020-07-02,ACANew Insider Filing on Arcosa IncsDirectorJOHN W LINDSAY
2020-07-02,ACANew Insider Filing on Arcosa IncsPresident amp CEOANTONIO CARRILLO
2020-07-01,ACANew Insider Filing on Arcosa IncsDirectorDAVID W BIEGLER
2020-07-01,ACANew Insider Filing on Arcosa IncsDirectorDOUGLAS L ROCK
2020-07-01,ACANew Insider Filing on Arcosa IncsDirectorRONALD J GAFFORD
2020-07-01,ACAs 10day Moving Average crossed above its 50day Moving Average on June 2 2020 View odds for this and other indicators  Arcosa stockmarket stock technicalanalysis money trading investing daytrading news today 
2020-07-01,ACA CreditAgricoleA surveiller audessus des des 864 objectif 975SwingTradingPro 
2020-07-01,ACA CreditAgricoleA surveiller audessus des des 864 objectif 975SwingTradingPro 
2020-06-30,ACAs 10day Moving Average crossed above its 50day Moving Average on June 2 2020 View odds for this and other indicators  Arcosa stockmarket stock technicalanalysis money trading investing daytrading news today 
2020-06-30,20 DMA Support today QTEC UONEK ISEE PDBC SQNS LKCO PRIM GF PUK VXX DG TWNK ACA MGEN GNPX DNOW GVA NOK HOOK HLIO  
2020-06-29,ACAs 10day Moving Average moved above its 50day Moving Average on June 2 2020 View odds for this and other indicators  Arcosa stockmarket stock technicalanalysis money trading investing daytrading news today 
2020-06-29,ACA CREDITAGRICOLE  1H Agricole On pourrait voir  court terme une acclration de la tendance haussire de fond sur cette unit de temps pour CREDIT AGRICOLE Cest un signal positif pour les acheteurs Tant que le cours se maintient 
2020-06-29,ACA CREDITAGRICOLE  1H On pourrait voir  court terme une acclration de la tendance haussire de fond sur cette unit de temps pour CREDIT AGRICOLE Cest un signal 
2020-06-28,ACA in Downtrend RSI indicator exits overbought zone View odds for this and other indicators  Arcosa stockmarket stock technicalanalysis money trading investing daytrading news today 
2020-06-27,OPPENHEIMER Top Trading Ideas June 202030 Best Trading Ideas from Equity ResearchACA ADBE AERI AVGO BL C COF COST CRBP CSL ENS ESTC ETN INCY IONS IOVA MDT NEP NET NKE RMD ROKU SPGI TCOM TTWO UNH VRTX VZ WEN WSC
2020-06-27,ACA in Downtrend RSI indicator exits overbought zone View odds for this and other indicators  Arcosa stockmarket stock technicalanalysis money trading investing daytrading news today 
2020-06-26,ACAs 10day Moving Average crossed above its 50day Moving Average on June 2 2020 View odds for this and other indicators  Arcosa stockmarket stock technicalanalysis money trading investing daytrading news today 
2020-06-26,La Ministra Romo dice ser de izquierda pero toda su familia le aca el jugo a la derecha incomprensible
2020-06-26,200 DMA Support today VSTM BTI CLXT FARO ACA  
2020-06-26,Si la cosa sigue as dentro de cuatro aos los robos de funcionarios del actual gobierno superarn con creces lo 700 millones defraudados al erario por Fune y aca buxos
2020-06-26,Arcosa Inc ACA is Harvey Partners LLCs 6th Largest Position 
